{
  "title": "Example product direction",
  "intent": "Clarify the experience before implementation planning.",
  "audiences": ["Primary users"],
  "targets": ["ui"],
  "industry": "b2b-saas",
  "sections": ["onboarding", "dashboards"],
  "themes": ["calm"],
  "message_structures": ["value-first"],
  "lenses": ["hierarchy", "comprehension", "accessibility", "trust"],
  "constraints": ["Preserve existing keyboard workflows"],
  "preserve": ["Current fast path for experienced users"],
  "open_questions": [],
  "source_note_ids": [],
  "memory_ids": []
}
